{"schema_version":1,"id":"care_home-4","name":"Residential care home for the elderly, 4 storeys","typology":"care_home","description":"12 care rooms per floor, nurse station at the lift lobby, staircases at both ends.","levels":[{"index":0,"label":"G/F","elevation":0.0,"height":4.5,"kind":"ground","features":[{"kind":"service","polygon":[[13.5,-6.75],[18.5,-6.75],[18.5,-0.75],[13.5,-0.75]],"label":"Sluice and store"}]},{"index":1,"label":"1/F","elevation":4.5,"height":2.8,"kind":"typical","features":[{"kind":"service","polygon":[[13.5,-6.75],[18.5,-6.75],[18.5,-0.75],[13.5,-0.75]],"label":"Sluice and store"}]},{"index":2,"label":"2/F","elevation":7.3,"height":2.8,"kind":"typical","features":[{"kind":"service","polygon":[[13.5,-6.75],[18.5,-6.75],[18.5,-0.75],[13.5,-0.75]],"label":"Sluice and store"}]},{"index":3,"label":"3/F","elevation":10.1,"height":2.8,"kind":"typical","features":[{"kind":"service","polygon":[[13.5,-6.75],[18.5,-6.75],[18.5,-0.75],[13.5,-0.75]],"label":"Sluice and store"}]}],"stairs":[{"id":"A","label":"Stair A","kind":"dogleg","clear_width":1.1,"riser":0.175,"going":0.25},{"id":"B","label":"Stair B","kind":"dogleg","clear_width":1.1,"riser":0.175,"going":0.25}],"nodes":[{"id":"L00.cor.0","type":"corridor","level":0,"x":2.25,"y":0.0,"label":"Corridor  at G/F","area":6.75,"polygon":[[0.0,-0.75],[4.5,-0.75],[4.5,0.75],[0.0,0.75]],"tags":[]},{"id":"L00.unit.01","type":"unit","level":0,"x":2.25,"y":3.75,"label":"Room 01 at G/F","area":27.0,"polygon":[[0.0,0.75],[4.5,0.75],[4.5,6.75],[0.0,6.75]],"unit_type":"care_room","tags":["care_home"]},{"id":"L00.unit.07","type":"unit","level":0,"x":2.25,"y":-3.75,"label":"Room 07 at G/F","area":27.0,"polygon":[[0.0,-6.75],[4.5,-6.75],[4.5,-0.75],[0.0,-0.75]],"unit_type":"care_room","tags":["care_home"]},{"id":"L00.cor.1","type":"corridor","level":0,"x":6.75,"y":0.0,"label":"Corridor  at G/F","area":6.75,"polygon":[[4.5,-0.75],[9.0,-0.75],[9.0,0.75],[4.5,0.75]],"tags":[]},{"id":"L00.unit.02","type":"unit","level":0,"x":6.75,"y":3.75,"label":"Room 02 at G/F","area":27.0,"polygon":[[4.5,0.75],[9.0,0.75],[9.0,6.75],[4.5,6.75]],"unit_type":"care_room","tags":["care_home"]},{"id":"L00.unit.08","type":"unit","level":0,"x":6.75,"y":-3.75,"label":"Room 08 at G/F","area":27.0,"polygon":[[4.5,-6.75],[9.0,-6.75],[9.0,-0.75],[4.5,-0.75]],"unit_type":"care_room","tags":["care_home"]},{"id":"L00.cor.2","type":"corridor","level":0,"x":11.25,"y":0.0,"label":"Corridor  at G/F","area":6.75,"polygon":[[9.0,-0.75],[13.5,-0.75],[13.5,0.75],[9.0,0.75]],"tags":[]},{"id":"L00.unit.03","type":"unit","level":0,"x":11.25,"y":3.75,"label":"Room 03 at G/F","area":27.0,"polygon":[[9.0,0.75],[13.5,0.75],[13.5,6.75],[9.0,6.75]],"unit_type":"care_room","tags":["care_home"]},{"id":"L00.unit.09","type":"unit","level":0,"x":11.25,"y":-3.75,"label":"Room 09 at G/F","area":27.0,"polygon":[[9.0,-6.75],[13.5,-6.75],[13.5,-0.75],[9.0,-0.75]],"unit_type":"care_room","tags":["care_home"]},{"id":"L00.cor.3","type":"corridor","level":0,"x":16.0,"y":0.0,"label":"Corridor  at G/F","area":7.5,"polygon":[[13.5,-0.75],[18.5,-0.75],[18.5,0.75],[13.5,0.75]],"tags":[]},{"id":"L00.liftlobby.nurse","type":"lift_lobby","level":0,"x":16.0,"y":3.75,"label":"Nurse station / lift lobby nurse at G/F","area":30.0,"polygon":[[13.5,0.75],[18.5,0.75],[18.5,6.75],[13.5,6.75]],"tags":["staff_station"]},{"id":"L00.cor.4","type":"corridor","level":0,"x":20.75,"y":0.0,"label":"Corridor  at G/F","area":6.75,"polygon":[[18.5,-0.75],[23.0,-0.75],[23.0,0.75],[18.5,0.75]],"tags":[]},{"id":"L00.unit.04","type":"unit","level":0,"x":20.75,"y":3.75,"label":"Room 04 at G/F","area":27.0,"polygon":[[18.5,0.75],[23.0,0.75],[23.0,6.75],[18.5,6.75]],"unit_type":"care_room","tags":["care_home"]},{"id":"L00.unit.10","type":"unit","level":0,"x":20.75,"y":-3.75,"label":"Room 10 at G/F","area":27.0,"polygon":[[18.5,-6.75],[23.0,-6.75],[23.0,-0.75],[18.5,-0.75]],"unit_type":"care_room","tags":["care_home"]},{"id":"L00.cor.5","type":"corridor","level":0,"x":25.25,"y":0.0,"label":"Corridor  at G/F","area":6.75,"polygon":[[23.0,-0.75],[27.5,-0.75],[27.5,0.75],[23.0,0.75]],"tags":[]},{"id":"L00.unit.05","type":"unit","level":0,"x":25.25,"y":3.75,"label":"Room 05 at G/F","area":27.0,"polygon":[[23.0,0.75],[27.5,0.75],[27.5,6.75],[23.0,6.75]],"unit_type":"care_room","tags":["care_home"]},{"id":"L00.unit.11","type":"unit","level":0,"x":25.25,"y":-3.75,"label":"Room 11 at G/F","area":27.0,"polygon":[[23.0,-6.75],[27.5,-6.75],[27.5,-0.75],[23.0,-0.75]],"unit_type":"care_room","tags":["care_home"]},{"id":"L00.cor.6","type":"corridor","level":0,"x":29.75,"y":0.0,"label":"Corridor  at G/F","area":6.75,"polygon":[[27.5,-0.75],[32.0,-0.75],[32.0,0.75],[27.5,0.75]],"tags":[]},{"id":"L00.unit.06","type":"unit","level":0,"x":29.75,"y":3.75,"label":"Room 06 at G/F","area":27.0,"polygon":[[27.5,0.75],[32.0,0.75],[32.0,6.75],[27.5,6.75]],"unit_type":"care_room","tags":["care_home"]},{"id":"L00.unit.12","type":"unit","level":0,"x":29.75,"y":-3.75,"label":"Room 12 at G/F","area":27.0,"polygon":[[27.5,-6.75],[32.0,-6.75],[32.0,-0.75],[27.5,-0.75]],"unit_type":"care_room","tags":["care_home"]},{"id":"L00.stair.A","type":"stair_landing","level":0,"x":-2.5,"y":0.0,"label":"Stair A landing at G/F","area":25.0,"polygon":[[0.0,-2.5],[0.0,2.5],[-5.0,2.5],[-5.0,-2.5]],"stair":"A","tags":[]},{"id":"L00.stair.B","type":"stair_landing","level":0,"x":34.5,"y":0.0,"label":"Stair B landing at G/F","area":25.0,"polygon":[[37.0,-2.5],[37.0,2.5],[32.0,2.5],[32.0,-2.5]],"stair":"B","tags":[]},{"id":"L00.exit.main","type":"exit","level":0,"x":16.0,"y":8.75,"label":"Main entrance","tags":[]},{"id":"L00.exit.A","type":"exit","level":0,"x":-7.0,"y":0.0,"label":"Stair A exit","tags":[]},{"id":"L00.exit.B","type":"exit","level":0,"x":39.0,"y":0.0,"label":"Stair B exit","tags":[]},{"id":"L01.cor.0","type":"corridor","level":1,"x":2.25,"y":0.0,"label":"Corridor  at 1/F","area":6.75,"polygon":[[0.0,-0.75],[4.5,-0.75],[4.5,0.75],[0.0,0.75]],"tags":[]},{"id":"L01.unit.01","type":"unit","level":1,"x":2.25,"y":3.75,"label":"Room 01 at 1/F","area":27.0,"polygon":[[0.0,0.75],[4.5,0.75],[4.5,6.75],[0.0,6.75]],"unit_type":"care_room","tags":["care_home"]},{"id":"L01.unit.07","type":"unit","level":1,"x":2.25,"y":-3.75,"label":"Room 07 at 1/F","area":27.0,"polygon":[[0.0,-6.75],[4.5,-6.75],[4.5,-0.75],[0.0,-0.75]],"unit_type":"care_room","tags":["care_home"]},{"id":"L01.cor.1","type":"corridor","level":1,"x":6.75,"y":0.0,"label":"Corridor  at 1/F","area":6.75,"polygon":[[4.5,-0.75],[9.0,-0.75],[9.0,0.75],[4.5,0.75]],"tags":[]},{"id":"L01.unit.02","type":"unit","level":1,"x":6.75,"y":3.75,"label":"Room 02 at 1/F","area":27.0,"polygon":[[4.5,0.75],[9.0,0.75],[9.0,6.75],[4.5,6.75]],"unit_type":"care_room","tags":["care_home"]},{"id":"L01.unit.08","type":"unit","level":1,"x":6.75,"y":-3.75,"label":"Room 08 at 1/F","area":27.0,"polygon":[[4.5,-6.75],[9.0,-6.75],[9.0,-0.75],[4.5,-0.75]],"unit_type":"care_room","tags":["care_home"]},{"id":"L01.cor.2","type":"corridor","level":1,"x":11.25,"y":0.0,"label":"Corridor  at 1/F","area":6.75,"polygon":[[9.0,-0.75],[13.5,-0.75],[13.5,0.75],[9.0,0.75]],"tags":[]},{"id":"L01.unit.03","type":"unit","level":1,"x":11.25,"y":3.75,"label":"Room 03 at 1/F","area":27.0,"polygon":[[9.0,0.75],[13.5,0.75],[13.5,6.75],[9.0,6.75]],"unit_type":"care_room","tags":["care_home"]},{"id":"L01.unit.09","type":"unit","level":1,"x":11.25,"y":-3.75,"label":"Room 09 at 1/F","area":27.0,"polygon":[[9.0,-6.75],[13.5,-6.75],[13.5,-0.75],[9.0,-0.75]],"unit_type":"care_room","tags":["care_home"]},{"id":"L01.cor.3","type":"corridor","level":1,"x":16.0,"y":0.0,"label":"Corridor  at 1/F","area":7.5,"polygon":[[13.5,-0.75],[18.5,-0.75],[18.5,0.75],[13.5,0.75]],"tags":[]},{"id":"L01.liftlobby.nurse","type":"lift_lobby","level":1,"x":16.0,"y":3.75,"label":"Nurse station / lift lobby nurse at 1/F","area":30.0,"polygon":[[13.5,0.75],[18.5,0.75],[18.5,6.75],[13.5,6.75]],"tags":["staff_station"]},{"id":"L01.cor.4","type":"corridor","level":1,"x":20.75,"y":0.0,"label":"Corridor  at 1/F","area":6.75,"polygon":[[18.5,-0.75],[23.0,-0.75],[23.0,0.75],[18.5,0.75]],"tags":[]},{"id":"L01.unit.04","type":"unit","level":1,"x":20.75,"y":3.75,"label":"Room 04 at 1/F","area":27.0,"polygon":[[18.5,0.75],[23.0,0.75],[23.0,6.75],[18.5,6.75]],"unit_type":"care_room","tags":["care_home"]},{"id":"L01.unit.10","type":"unit","level":1,"x":20.75,"y":-3.75,"label":"Room 10 at 1/F","area":27.0,"polygon":[[18.5,-6.75],[23.0,-6.75],[23.0,-0.75],[18.5,-0.75]],"unit_type":"care_room","tags":["care_home"]},{"id":"L01.cor.5","type":"corridor","level":1,"x":25.25,"y":0.0,"label":"Corridor  at 1/F","area":6.75,"polygon":[[23.0,-0.75],[27.5,-0.75],[27.5,0.75],[23.0,0.75]],"tags":[]},{"id":"L01.unit.05","type":"unit","level":1,"x":25.25,"y":3.75,"label":"Room 05 at 1/F","area":27.0,"polygon":[[23.0,0.75],[27.5,0.75],[27.5,6.75],[23.0,6.75]],"unit_type":"care_room","tags":["care_home"]},{"id":"L01.unit.11","type":"unit","level":1,"x":25.25,"y":-3.75,"label":"Room 11 at 1/F","area":27.0,"polygon":[[23.0,-6.75],[27.5,-6.75],[27.5,-0.75],[23.0,-0.75]],"unit_type":"care_room","tags":["care_home"]},{"id":"L01.cor.6","type":"corridor","level":1,"x":29.75,"y":0.0,"label":"Corridor  at 1/F","area":6.75,"polygon":[[27.5,-0.75],[32.0,-0.75],[32.0,0.75],[27.5,0.75]],"tags":[]},{"id":"L01.unit.06","type":"unit","level":1,"x":29.75,"y":3.75,"label":"Room 06 at 1/F","area":27.0,"polygon":[[27.5,0.75],[32.0,0.75],[32.0,6.75],[27.5,6.75]],"unit_type":"care_room","tags":["care_home"]},{"id":"L01.unit.12","type":"unit","level":1,"x":29.75,"y":-3.75,"label":"Room 12 at 1/F","area":27.0,"polygon":[[27.5,-6.75],[32.0,-6.75],[32.0,-0.75],[27.5,-0.75]],"unit_type":"care_room","tags":["care_home"]},{"id":"L01.stair.A","type":"stair_landing","level":1,"x":-2.5,"y":0.0,"label":"Stair A landing at 1/F","area":25.0,"polygon":[[0.0,-2.5],[0.0,2.5],[-5.0,2.5],[-5.0,-2.5]],"stair":"A","tags":[]},{"id":"L01.stair.B","type":"stair_landing","level":1,"x":34.5,"y":0.0,"label":"